ID,Title,Summary,Tone
1,sunt aut facere repellat provident occaecati excepturi optio reprehenderit,This text explores the abstract consequences and responsibilities associated with human actions and decision-making.,neutral
2,qui est esse,"This text explores the complexities of the human experience, weighing the pursuit of fulfillment against the inevitable challenges and pains of life.",emotional
3,ea molestias quasi exercitationem repellat qui ipsa sit aut,"This placeholder text describes a sequence of choices involving various pleasures, duties, and efforts.",neutral
4,eum et est occaecati,The text explores the philosophical relationship between making specific choices and the resulting consequences or responsibilities.,neutral
5,nesciunt quas odio,"This text uses Latin placeholder phrases to describe various abstract concepts related to pleasure, pain, and choice.",neutral
